{
  "protocolVersion": 1,
  "messageId": "33333333-3333-4333-8333-333333333333",
  "clientInstanceId": "11111111-1111-4111-8111-111111111111",
  "messageType": "job.save",
  "occurredAt": "2026-09-06T12:00:00.000Z",
  "payload": {
    "sourceRestoreEpoch": "bbbbbbbb-bbbb-4bbb-8bbb-bbbbbbbbbbbb",
    "company": "合成公司",
    "title": "后端实习",
    "sourceUrl": "https://jobs.example/#token=TOPSECRET?page=2",
    "payloadSha256": "f392cd6b906130d6340280085b9811a3ab6a1e7c40caaf4db2a21c3008386a0b"
  },
  "archiveId": "aaaaaaaa-aaaa-4aaa-8aaa-aaaaaaaaaaaa",
  "restoreEpoch": "bbbbbbbb-bbbb-4bbb-8bbb-bbbbbbbbbbbb"
}
