{
  "protocolVersion": 2,
  "messageId": "33333333-3333-4333-8333-333333333333",
  "clientInstanceId": "11111111-1111-4111-8111-111111111111",
  "messageType": "legacy.import",
  "occurredAt": "2026-09-23T12:00:00.000Z",
  "payload": {
    "importId": "66666666-6666-4666-8666-666666666666",
    "kind": "profile",
    "index": 1,
    "body": {
      "values": {
        "fullName": 42
      },
      "family": [
        {
          "relation": "parent",
          "name": "Bob"
        }
      ],
      "custom": [
        {
          "key": "Portfolio",
          "value": "https://example.com"
        }
      ]
    }
  },
  "archiveId": "aaaaaaaa-aaaa-4aaa-8aaa-aaaaaaaaaaaa",
  "restoreEpoch": "bbbbbbbb-bbbb-4bbb-8bbb-bbbbbbbbbbbb"
}
