{
  "protocolVersion": 2,
  "messageId": "33333333-3333-4333-8333-333333333333",
  "clientInstanceId": "11111111-1111-4111-8111-111111111111",
  "messageType": "resume.update",
  "occurredAt": "2026-09-23T12:00:00.000Z",
  "payload": {
    "op": "saveProfile",
    "profile": {
      "values": {},
      "family": [],
      "custom": [
        {
          "key": "Cookie 研究方向",
          "value": "abc"
        }
      ]
    },
    "expectedRevision": 0
  },
  "archiveId": "aaaaaaaa-aaaa-4aaa-8aaa-aaaaaaaaaaaa",
  "restoreEpoch": "bbbbbbbb-bbbb-4bbb-8bbb-bbbbbbbbbbbb"
}
