{
  "protocolVersion": 2,
  "messageId": "33333333-3333-4333-8333-333333333333",
  "clientInstanceId": "11111111-1111-4111-8111-111111111111",
  "messageType": "legacy.import",
  "occurredAt": "2026-09-23T12:00:00.000Z",
  "payload": {
    "importId": "66666666-6666-4666-8666-666666666666",
    "kind": "manifest",
    "index": 0,
    "body": {
      "pluginVersion": "0.4.0",
      "total": 2,
      "parts": [
        {
          "index": 1,
          "kind": "template",
          "sha256": "aaaaaaaaaaaaaaaaaaaaaaaaaaaaaaaaaaaaaaaaaaaaaaaaaaaaaaaaaaaaaaaa"
        }
      ]
    }
  },
  "archiveId": "aaaaaaaa-aaaa-4aaa-8aaa-aaaaaaaaaaaa",
  "restoreEpoch": "bbbbbbbb-bbbb-4bbb-8bbb-bbbbbbbbbbbb"
}
