{
  "protocolVersion": 2,
  "messageId": "33333333-3333-4333-8333-333333333333",
  "clientInstanceId": "11111111-1111-4111-8111-111111111111",
  "messageType": "ai.complete",
  "occurredAt": "2026-10-07T12:00:00.000Z",
  "payload": {
    "purpose": "fill",
    "tier": "strong",
    "system": "SYS",
    "user": "表单字段列表：[]"
  }
}
