{
  "protocolVersion": 1,
  "messageId": "33333333-3333-4333-8333-333333333333",
  "clientInstanceId": "11111111-1111-4111-8111-111111111111",
  "messageType": "fill.submit",
  "occurredAt": "2026-09-06T12:00:00.000Z",
  "payload": {
    "sourceRestoreEpoch": "bbbbbbbb-bbbb-4bbb-8bbb-bbbbbbbbbbbb",
    "applicationId": "77777777-7777-4777-8777-777777777777",
    "outcome": "completed",
    "fieldCount": 1,
    "filledCount": 100,
    "durationsMs": {
      "scan": 40,
      "match": 80,
      "fill": 120,
      "total": 240
    },
    "urlRedacted": "https://jobs.example.com/apply?utm_source=mail",
    "templateName": "默认模板",
    "templateVersion": "1",
    "pluginVersion": "0.3.0",
    "payloadSha256": "a290f8c03ade7060f2e9330bb80b1e6005e403b133fed314616f681b2a3ca6e5"
  },
  "archiveId": "aaaaaaaa-aaaa-4aaa-8aaa-aaaaaaaaaaaa",
  "restoreEpoch": "bbbbbbbb-bbbb-4bbb-8bbb-bbbbbbbbbbbb"
}
