{
  "protocolVersion": 1,
  "messageId": "33333333-3333-4333-8333-333333333333",
  "clientInstanceId": "11111111-1111-4111-8111-111111111111",
  "messageType": "fill.submit",
  "occurredAt": "2026-09-06T12:00:00.000Z",
  "payload": {
    "sourceRestoreEpoch": "bbbbbbbb-bbbb-4bbb-8bbb-bbbbbbbbbbbb",
    "applicationId": "77777777-7777-4777-8777-777777777777",
    "payloadSha256": "aaaaaaaaaaaaaaaaaaaaaaaaaaaaaaaaaaaaaaaaaaaaaaaaaaaaaaaaaaaaaaaa"
  },
  "archiveId": "aaaaaaaa-aaaa-4aaa-8aaa-aaaaaaaaaaaa",
  "restoreEpoch": "bbbbbbbb-bbbb-4bbb-8bbb-bbbbbbbbbbbb"
}
