{
  "protocolVersion": 1,
  "messageId": "33333333-3333-4333-8333-333333333333",
  "clientInstanceId": "11111111-1111-4111-8111-111111111111",
  "messageType": "job.save",
  "occurredAt": "2026-09-06T12:00:00.000Z",
  "payload": {
    "sourceRestoreEpoch": "bbbbbbbb-bbbb-4bbb-8bbb-bbbbbbbbbbbb",
    "company": "合成公司",
    "title": "后端实习",
    "payloadSha256": "c8a2cf492fb0e9c138c785b3c5e7b0a19c18929f53e8b4bad60fd488f5906edb",
    "sourceUrl": "https://jobs.example?access_token=test"
  },
  "archiveId": "aaaaaaaa-aaaa-4aaa-8aaa-aaaaaaaaaaaa",
  "restoreEpoch": "bbbbbbbb-bbbb-4bbb-8bbb-bbbbbbbbbbbb"
}
