{
  "protocolVersion": 1,
  "messageId": "33333333-3333-4333-8333-333333333333",
  "clientInstanceId": "11111111-1111-4111-8111-111111111111",
  "messageType": "job.save",
  "occurredAt": "2026-09-06T12:00:00.000Z",
  "payload": {
    "sourceRestoreEpoch": "bbbbbbbb-bbbb-4bbb-8bbb-bbbbbbbbbbbb",
    "company": "合成公司",
    "title": "后端实习",
    "payloadSha256": "1ea8fcf15e56dd83a5e7f8e9adb0c34b94bc28fd5c1b51400ecf597d1f5cc8c4"
  }
}
