{
  "protocolVersion": 1,
  "messageId": "44444444-4444-4444-8444-444444444444",
  "clientInstanceId": "11111111-1111-4111-8111-111111111111",
  "messageType": "snapshot.chunk",
  "occurredAt": "2026-09-06T12:00:00.000Z",
  "payload": {
    "sourceRestoreEpoch": "bbbbbbbb-bbbb-4bbb-8bbb-bbbbbbbbbbbb",
    "snapshotId": "66666666-6666-4666-8666-666666666666",
    "applicationId": "77777777-7777-4777-8777-777777777777",
    "chunkIndex": 1,
    "chunkCount": 2,
    "chunkSha256": "eaedf3a49c391c0207a1e7e4ae976941b384bf6137ffa5573d3522c1297806d4",
    "snapshotSha256": "9f9f5111f7b27a781f1f1ddde5ebc2dd2b796bfc7365c9c28b548e564176929f",
    "byteSize": 16,
    "bytesBase64": "ODlhYmNkZWY="
  },
  "archiveId": "aaaaaaaa-aaaa-4aaa-8aaa-aaaaaaaaaaaa",
  "restoreEpoch": "bbbbbbbb-bbbb-4bbb-8bbb-bbbbbbbbbbbb"
}
