{
  "protocolVersion": 2,
  "messageId": "33333333-3333-4333-8333-333333333333",
  "clientInstanceId": "11111111-1111-4111-8111-111111111111",
  "messageType": "resume.update",
  "occurredAt": "2026-09-23T12:00:00.000Z",
  "payload": {
    "op": "saveTemplate",
    "templateId": "55555555-5555-4555-8555-555555555555",
    "groups": [
      {
        "name": "空",
        "fields": []
      }
    ],
    "baseSha256": "d2d71fabd5d084928e23d31a3e0e429705266391b0737b35cb12cb06d5c7a34d"
  },
  "archiveId": "aaaaaaaa-aaaa-4aaa-8aaa-aaaaaaaaaaaa",
  "restoreEpoch": "bbbbbbbb-bbbb-4bbb-8bbb-bbbbbbbbbbbb"
}
