{
  "protocolVersion": 2,
  "messageId": "33333333-3333-4333-8333-333333333333",
  "clientInstanceId": "11111111-1111-4111-8111-111111111111",
  "messageType": "legacy.import",
  "occurredAt": "2026-09-23T12:00:00.000Z",
  "payload": {
    "importId": "66666666-6666-4666-8666-666666666666",
    "kind": "aiConfig",
    "index": 1,
    "body": {
      "apiUrl": "http://192.168.1.5:8000/v1/chat/completions",
      "model": "model-x",
      "apiKey": "sk-abcdefghijklmnopqrstuvwxyz123456"
    }
  },
  "archiveId": "aaaaaaaa-aaaa-4aaa-8aaa-aaaaaaaaaaaa",
  "restoreEpoch": "bbbbbbbb-bbbb-4bbb-8bbb-bbbbbbbbbbbb"
}
